{
  "title": "Koh Chang’s Ghost Ship: What Remains?",
  "requested_title": "The Mystery Ghost Ship Left to Rot in a Thai Jungle (Koh Chang Part 2 — Exact GPS Coordinates)",
  "slug": "koh-chang-galaxy-after-the-fire",
  "channel": "Amazing Random Things",
  "format": "YouTube Short",
  "target_duration_seconds": 60,
  "aspect_ratio": "9:16",
  "fps_master": 30,
  "audio_master": true,
  "visual_lock": "Vertical 9:16 documentary travel mystery; humid Gulf of Thailand haze, emerald jungle, lagoon, weathered concrete and rust; naturalistic restrained teal/amber grade, slow stabilized camera. No supernatural apparitions, fabricated signage, trespassing, or invented present-day intact ship. Any intact Galaxy must be explicitly labeled archival reconstruction and matched to supplied licensed reference images.",
  "reference_sheet_prompt": "Create a documentary reference sheet for Koh Chang: (1) present-day southern Koh Chang lagoon and tropical shoreline, (2) a clearly labeled archival reconstruction of the former seven-deck Galaxy ship-hotel based only on supplied reference photographs, (3) a clean map panel locating Koh Chang, Trat, Thailand. Maintain realistic geography and muted emerald/teal/amber palette. No ghosts, logos, fabricated text, or implication the ship survives the 2024 fire. Use as consistent reference for all blocks.",
  "important_factual_note": "Important factual correction: The Galaxy ship-hotel was severely burned on 3 December 2024; a 2025 local update reports dismantling of its upper structure. Do not present the intact ship as currently standing. No current 2026 on-site inspection is available here; verify the present site, remnants and legal access before publication.",
  "source_citations": [
    "https://iamkohchang.com/photos/various/galaxy-koh-chang-ghost-ship.html",
    "https://world.thaipbs.or.th/detail/koh-changs-haunted-ghost-ship-goes-up-in-flames/55670",
    "https://www.jertam.com/places/30391"
  ],
  "blocks": [
    {
      "id": "block_01_hook",
      "duration_target_seconds": 5,
      "narration": "On Koh Chang, this ghost ship hotel once anchored a jungle lagoon. Now the Galaxy is gone.",
      "visual_prompt": "Vertical 9:16 documentary travel mystery; humid Gulf of Thailand haze, emerald jungle, lagoon, weathered concrete and rust; naturalistic restrained teal/amber grade, slow stabilized camera. No supernatural apparitions, fabricated signage, trespassing, or invented present-day intact ship. Any intact Galaxy must be explicitly labeled archival reconstruction and matched to supplied licensed reference images. Shot: Aerial over tropical lagoon; reveal empty site, not intact ship. Important factual correction: The Galaxy ship-hotel was severely burned on 3 December 2024; a 2025 local update reports dismantling of its upper structure. Do not present the intact ship as currently standing. No current 2026 on-site inspection is available here; verify the present site, remnants and legal access before publication.",
      "first_frame_prompt": "Block 01 first frame: Aerial over tropical lagoon; reveal empty site, not intact ship. Match the exact preceding final frame, location, lens direction, weather and grade. No unprovided text.",
      "last_frame_prompt": "Block 01 final frame: Aerial over tropical lagoon; reveal empty site, not intact ship. Settle on stable composition matching next block first keyframe; block 12 must match block 01 opening. No morphing or unsupported details.",
      "motion_prompt": "Five-second documentary shot: Aerial over tropical lagoon; reveal empty site, not intact ship. slow controlled motion. At t=2.5s apply subtle 1.12x punch-in as post effect, not model instruction. Last 8 frames settle for chaining.",
      "overlay_title": "KOH CHANG • THAILAND",
      "overlay_detail": "11.9763, 102.3332*",
      "coordinates": "",
      "location": "Koh Chang Grand Lagoona, southern Koh Chang, Trat, Thailand",
      "timeline": "Present day",
      "elevation_m": null,
      "audio": "audio/block_01_hook.wav",
      "clip": "clips/block_01_hook.mp4",
      "seed": 46001,
      "model_version": "RECORD_BEFORE_RENDER",
      "status": "planned",
      "continuity": "Previous block last frame is required as first-frame reference; block 12 targets block 01 for loop.",
      "source_notes": "Important factual correction: The Galaxy ship-hotel was severely burned on 3 December 2024; a 2025 local update reports dismantling of its upper structure. Do not present the intact ship as currently standing. No current 2026 on-site inspection is available here; verify the present site, remnants and legal access before publication."
    },
    {
      "id": "block_02_map",
      "duration_target_seconds": 5,
      "narration": "Find the site near Bang Bao, on Koh Chang’s southern coast in Trat Province.",
      "visual_prompt": "Vertical 9:16 documentary travel mystery; humid Gulf of Thailand haze, emerald jungle, lagoon, weathered concrete and rust; naturalistic restrained teal/amber grade, slow stabilized camera. No supernatural apparitions, fabricated signage, trespassing, or invented present-day intact ship. Any intact Galaxy must be explicitly labeled archival reconstruction and matched to supplied licensed reference images. Shot: Map zoom Thailand to Koh Chang and southern Bang Bao; pin marked approximate. Important factual correction: The Galaxy ship-hotel was severely burned on 3 December 2024; a 2025 local update reports dismantling of its upper structure. Do not present the intact ship as currently standing. No current 2026 on-site inspection is available here; verify the present site, remnants and legal access before publication.",
      "first_frame_prompt": "Block 02 first frame: Map zoom Thailand to Koh Chang and southern Bang Bao; pin marked approximate. Match the exact preceding final frame, location, lens direction, weather and grade. No unprovided text.",
      "last_frame_prompt": "Block 02 final frame: Map zoom Thailand to Koh Chang and southern Bang Bao; pin marked approximate. Settle on stable composition matching next block first keyframe; block 12 must match block 01 opening. No morphing or unsupported details.",
      "motion_prompt": "Five-second documentary shot: Map zoom Thailand to Koh Chang and southern Bang Bao; pin marked approximate. slow controlled motion. At t=2.5s apply subtle 1.12x punch-in as post effect, not model instruction. Last 8 frames settle for chaining.",
      "overlay_title": "SOUTHERN KOH CHANG",
      "overlay_detail": "APPROX. MAP PIN",
      "coordinates": "11.9763° N, 102.3332° E (approximate public listing; confirm the pin before publication)",
      "location": "Koh Chang Grand Lagoona, southern Koh Chang, Trat, Thailand",
      "timeline": "Location",
      "elevation_m": null,
      "audio": "audio/block_02_map.wav",
      "clip": "clips/block_02_map.mp4",
      "seed": 46002,
      "model_version": "RECORD_BEFORE_RENDER",
      "status": "planned",
      "continuity": "Previous block last frame is required as first-frame reference; block 12 targets block 01 for loop.",
      "source_notes": "Important factual correction: The Galaxy ship-hotel was severely burned on 3 December 2024; a 2025 local update reports dismantling of its upper structure. Do not present the intact ship as currently standing. No current 2026 on-site inspection is available here; verify the present site, remnants and legal access before publication."
    },
    {
      "id": "block_03_name",
      "duration_target_seconds": 5,
      "narration": "The vessel was called The Galaxy, part of the Koh Chang Grand Lagoona resort.",
      "visual_prompt": "Vertical 9:16 documentary travel mystery; humid Gulf of Thailand haze, emerald jungle, lagoon, weathered concrete and rust; naturalistic restrained teal/amber grade, slow stabilized camera. No supernatural apparitions, fabricated signage, trespassing, or invented present-day intact ship. Any intact Galaxy must be explicitly labeled archival reconstruction and matched to supplied licensed reference images. Shot: Clearly labeled archival reconstruction of ship-hotel in lagoon. Important factual correction: The Galaxy ship-hotel was severely burned on 3 December 2024; a 2025 local update reports dismantling of its upper structure. Do not present the intact ship as currently standing. No current 2026 on-site inspection is available here; verify the present site, remnants and legal access before publication.",
      "first_frame_prompt": "Block 03 first frame: Clearly labeled archival reconstruction of ship-hotel in lagoon. Match the exact preceding final frame, location, lens direction, weather and grade. No unprovided text.",
      "last_frame_prompt": "Block 03 final frame: Clearly labeled archival reconstruction of ship-hotel in lagoon. Settle on stable composition matching next block first keyframe; block 12 must match block 01 opening. No morphing or unsupported details.",
      "motion_prompt": "Five-second documentary shot: Clearly labeled archival reconstruction of ship-hotel in lagoon. slow controlled motion. At t=2.5s apply subtle 1.12x punch-in as post effect, not model instruction. Last 8 frames settle for chaining.",
      "overlay_title": "THE GALAXY",
      "overlay_detail": "ARCHIVAL RECONSTRUCTION",
      "coordinates": "",
      "location": "Koh Chang Grand Lagoona, southern Koh Chang, Trat, Thailand",
      "timeline": "Resort era",
      "elevation_m": null,
      "audio": "audio/block_03_name.wav",
      "clip": "clips/block_03_name.mp4",
      "seed": 46003,
      "model_version": "RECORD_BEFORE_RENDER",
      "status": "planned",
      "continuity": "Previous block last frame is required as first-frame reference; block 12 targets block 01 for loop.",